{
  "reviewedAt": "2026-09-22",
  "disclaimer": "Requested stay: 5 November 2026 to 28 April 2027. Quoted base rents exclude unresolved bills, deposits and fees. Source facts are advertised, not inspected; only a complete-stay search result confirms source availability. All map distances are guesstimates. No owners contacted or bookings made.",
  "pairs": [
    {
      "id": "alegria-490846-500866",
      "rank": 1,
      "paperId": "P-490846",
      "apartmentId": "P-500866",
      "title": "PAPER 003 — Torrevieja - Del Cura / Los Locos",
      "summary": "Separate furnished listings; quoted base rents only. See each source note.",
      "status": "provisional",
      "statusNote": "Exact-stay and terms as noted per apartment; map routes are estimates, not verified entrances.",
      "areas": [
        "Torrevieja - Del Cura / Los Locos"
      ],
      "beachDistanceMinutes": null,
      "combinedMonthlyRentEur": 900,
      "poolDistance": "P-490846: Not listed; access unconfirmed.\n\nP-500866: Not listed; access unconfirmed.",
      "beachDistance": "P-490846: Advertised: Los Locos300m,Del Cura500m\n\nP-500866: Advertised: Del Cura200m",
      "groceriesDistance": "P-490846: Advertised: 150m\n\nP-500866: Advertised: Masymas 60m",
      "cafesDistance": "P-490846: guesstimate midpoint 150 m (range 50-250 m)\n\nP-500866: guesstimate midpoint 150 m (range 50-250 m)",
      "pairWalkingDistance": "guesstimate midpoint 400 m (range 250-550 m), public map/street evidence; not door-to-door.",
      "pairWalkingTime": "Not assessed; compare approximate metres only.",
      "paper": {
        "id": "P-490846",
        "displayName": "P-490846 - Alegria ID 45",
        "area": "Torrevieja - Del Cura / Los Locos",
        "address": null,
        "bedrooms": 0,
        "sizeSqm": 33,
        "monthlyRentEur": 400,
        "furnished": true,
        "availabilityStatus": "confirmed",
        "availabilityNote": "On 22 September 2026, the original listing's search returned Available after accepting check-in 05/11/2026 and check-out 28/04/2027 with one adult selected; EUR 400/month remained displayed. This confirms the source's complete-stay availability result at checking time, not a reservation or binding all-in offer. The furnished studio has no separate bedroom. Water, electricity, gas if applicable, internet, final cleaning and deposit are extra; the feature table quotes EUR 80 final cleaning, while internet inclusion conflicts with the description. Other amounts and contract terms remain unverified. Also appears in PAPER 003, 004, 006, 009, 014, 017.",
        "originalListingUrl": "https://www.alegria-rent.com/en/long-term-rental/apartment-torrevieja-id45-490846.html",
        "photoSourceUrl": "https://www.alegria-rent.com/en/long-term-rental/apartment-torrevieja-id45-490846.html",
        "photoAttribution": "Alegria original gallery",
        "photos": [
          {
            "url": "https://www.alegria-rent.com/en/long-term-rental/fotos/2/17182928203065ea26956bb5b402fdbf70b8f50d0d/1718292823ffe26d55df85195e2de502106d5200a4.jpg",
            "alt": "Outward street view across the neighbouring facade and road crossing.",
            "sourceUrl": "https://www.alegria-rent.com/en/long-term-rental/apartment-torrevieja-id45-490846.html",
            "attribution": "Alegria original gallery",
            "aiEdited": false
          },
          {
            "url": "https://www.alegria-rent.com/en/long-term-rental/fotos/2/17182928203065ea26956bb5b402fdbf70b8f50d0d/1718292820e3510cba09d7d0ceda7028a7067ce5b7.jpg",
            "alt": "Living and dining room with orange sofa and blue armchair.",
            "sourceUrl": "https://www.alegria-rent.com/en/long-term-rental/apartment-torrevieja-id45-490846.html",
            "attribution": "Alegria original gallery",
            "aiEdited": false
          },
          {
            "url": "https://www.alegria-rent.com/en/long-term-rental/fotos/2/17182928203065ea26956bb5b402fdbf70b8f50d0d/17182928223dd7d0bfb7c9bfa8b91d72ac558f6bbc.jpg",
            "alt": "Kitchen counter, refrigerator, hob and blue tile border.",
            "sourceUrl": "https://www.alegria-rent.com/en/long-term-rental/apartment-torrevieja-id45-490846.html",
            "attribution": "Alegria original gallery",
            "aiEdited": false
          },
          {
            "url": "https://www.alegria-rent.com/en/long-term-rental/fotos/2/17182928203065ea26956bb5b402fdbf70b8f50d0d/1718292822ed3e6cf54efeb50f66403fbd6c7f5dc9.jpg",
            "alt": "Bathroom basin, toilet and bathtub with shower curtain.",
            "sourceUrl": "https://www.alegria-rent.com/en/long-term-rental/apartment-torrevieja-id45-490846.html",
            "attribution": "Alegria original gallery",
            "aiEdited": false
          },
          {
            "url": "https://www.alegria-rent.com/en/long-term-rental/fotos/2/17182928203065ea26956bb5b402fdbf70b8f50d0d/1718292822f1e99d564a5918f2d27f5fb2e7989ca4.jpg",
            "alt": "Glazed balcony with chairs and yellow curtains.",
            "sourceUrl": "https://www.alegria-rent.com/en/long-term-rental/apartment-torrevieja-id45-490846.html",
            "attribution": "Alegria original gallery",
            "aiEdited": false
          },
          {
            "url": "https://www.alegria-rent.com/en/long-term-rental/fotos/2/17182928203065ea26956bb5b402fdbf70b8f50d0d/17182928245ce29aae059c18361b717534265cddb8.jpg",
            "alt": "Communal stair landing and lift door.",
            "sourceUrl": "https://www.alegria-rent.com/en/long-term-rental/apartment-torrevieja-id45-490846.html",
            "attribution": "Alegria original gallery",
            "aiEdited": false
          },
          {
            "url": "https://www.alegria-rent.com/en/long-term-rental/fotos/2/17182928203065ea26956bb5b402fdbf70b8f50d0d/17182928225bf848c55d515b315e0f6faa052246fd.jpg",
            "alt": "Entrance hallway with mirror and storage.",
            "sourceUrl": "https://www.alegria-rent.com/en/long-term-rental/apartment-torrevieja-id45-490846.html",
            "attribution": "Alegria original gallery",
            "aiEdited": false
          },
          {
            "url": "https://www.alegria-rent.com/en/long-term-rental/fotos/2/17182928203065ea26956bb5b402fdbf70b8f50d0d/1718292823c774edf7bdb8abbc1b591599ae8a9683.jpg",
            "alt": "Kitchen with washing machine and cooking area.",
            "sourceUrl": "https://www.alegria-rent.com/en/long-term-rental/apartment-torrevieja-id45-490846.html",
            "attribution": "Alegria original gallery",
            "aiEdited": false
          },
          {
            "url": "https://www.alegria-rent.com/en/long-term-rental/fotos/2/17182928203065ea26956bb5b402fdbf70b8f50d0d/171829282300b3e9efc8ad59b5000935471fa2cb57.jpg",
            "alt": "Outward street view in the other direction, with green awning.",
            "sourceUrl": "https://www.alegria-rent.com/en/long-term-rental/apartment-torrevieja-id45-490846.html",
            "attribution": "Alegria original gallery",
            "aiEdited": false
          }
        ],
        "sourceName": "Alegria Holiday Rentals",
        "sourceCheckedAt": "2026-09-22"
      },
      "apartment": {
        "id": "P-500866",
        "displayName": "P-500866 - Alegria ID 105",
        "area": "Torrevieja - Del Cura / Los Locos",
        "address": null,
        "bedrooms": 0,
        "sizeSqm": 38,
        "monthlyRentEur": 500,
        "furnished": true,
        "availabilityStatus": "unknown",
        "availabilityNote": "Checked 22 September 2026. The date fields accepted 05/11/2026 and 28/04/2027, but Search returned an error saying the number of occupants exceeds the maximum permitted while one adult was selected. No usable complete-stay availability result was obtained; availability remains unknown. The furnished studio advert quotes EUR 500/month and has no separate bedroom. Utilities, internet, final cleaning and deposit are extra; amounts and full-stay contract price remain unverified. The description charges utilities/internet/cleaning separately while some feature fields say included; treat inclusion as unresolved. Also appears in PAPER 003, 005, 007, 015, 018.",
        "originalListingUrl": "https://www.alegria-rent.com/en/long-term-rental/apartment-torrevieja-id105-500866.html",
        "photoSourceUrl": "https://www.alegria-rent.com/en/long-term-rental/apartment-torrevieja-id105-500866.html",
        "photoAttribution": "Alegria original gallery",
        "photos": [
          {
            "url": "https://www.alegria-rent.com/en/long-term-rental/fotos/2/1725440087effd88a579707bab41cdc7649f9c59fa/1725440089eae1ef60492d0a6d4494ee7cf13bba03.jpg",
            "alt": "Outdoor balcony with white balustrade and street view.",
            "sourceUrl": "https://www.alegria-rent.com/en/long-term-rental/apartment-torrevieja-id105-500866.html",
            "attribution": "Alegria original gallery",
            "aiEdited": false
          },
          {
            "url": "https://www.alegria-rent.com/en/long-term-rental/fotos/2/1725440087effd88a579707bab41cdc7649f9c59fa/172544008762c60a036081733cf607c755de0e38f3.jpg",
            "alt": "Studio living and dining area facing the balcony door.",
            "sourceUrl": "https://www.alegria-rent.com/en/long-term-rental/apartment-torrevieja-id105-500866.html",
            "attribution": "Alegria original gallery",
            "aiEdited": false
          },
          {
            "url": "https://www.alegria-rent.com/en/long-term-rental/fotos/2/1725440087effd88a579707bab41cdc7649f9c59fa/1725440088650ade000393744d443b1a5cf2c2df67.jpg",
            "alt": "Kitchen with oven, hob and red trim.",
            "sourceUrl": "https://www.alegria-rent.com/en/long-term-rental/apartment-torrevieja-id105-500866.html",
            "attribution": "Alegria original gallery",
            "aiEdited": false
          },
          {